{
  "schemaVersion": 2,
  "protocolId": "m5-framework-lanes-v2",
  "fixtureRevision": 3,
  "cellId": "l0-product-codex-r3-seed1",
  "lane": "L0",
  "task": "product",
  "host": "codex",
  "seed": 1,
  "projectRoot": "C:\\Users\\joinj\\AppData\\Local\\Temp\\skill-rails-m5-l0-product-codex-r3-seed1-EeaA3v",
  "startedAt": "2026-09-13T16:10:49.489Z",
  "protocolSha256": "80303a1e6e13d2532bae0cf20f2e8ea927f05230d4a26b4dd925f5dbb4e8db91",
  "workspace": {
    "copiedEntries": [
      "package.json",
      "package-lock.json",
      "authoring-package.json",
      "contracts",
      "src",
      "authoring",
      "domains",
      "fixtures",
      "tests",
      "skills",
      "docs/guide"
    ],
    "excludedEntries": [
      "tests/framework-harness.test.mjs"
    ],
    "preconditions": [
      {
        "name": "fixture:domains/natural-language-pilot/skill-package.json",
        "ok": true,
        "evidence": "domains/natural-language-pilot/skill-package.json"
      },
      {
        "name": "fixture:pilot/product-request.md",
        "ok": true,
        "evidence": "pilot/product-request.md"
      },
      {
        "name": "harness-self-test-excluded",
        "ok": true,
        "evidence": "tests/framework-harness.test.mjs"
      },
      {
        "name": "framework-original-hash",
        "ok": true,
        "evidence": "17879eb8f94dde7ea0fe14b03258eebf94fd0efb92bb014dae2c902bcc7654d7"
      },
      {
        "name": "lane-source-current",
        "ok": true,
        "evidence": "0:{\"schemaVersion\":1,\"status\":\"CHECKED\",\"targetId\":\"skill-rails-next\",\"artifactIntact\":true,\"sourceCurrent\":true,\"remoteLatest\":null,\"treeSha256\":\"80c699bf6efe69e7f9dcd27b156348ed4dc496a0b88f75dee816a3aa7c057b2f\"}:"
      },
      {
        "name": "host-version",
        "ok": true,
        "evidence": "0:codex-cli 0.148.0:"
      },
      {
        "name": "host-command-surface",
        "ok": true,
        "evidence": "help-exit:0"
      },
      {
        "name": "fixture-test-suite",
        "ok": true,
        "evidence": "0:> @nanomia/skill-rails-next@1.0.0-alpha.1 test\n> node --test tests/*.test.mjs\n\n✔ same source builds byte-identical standalone target trees (387.4461ms)\n✔ authoring target materializes the Framework original and a semantic-free deterministic heading index (335.1642ms)\n✔ copied target checks integrity without repository or sibling skill access (399.9035ms)\n✔ record-only target materializes only its public runtime commands (451.6669ms)\n✔ authoring check and installed check distinguish a hand-edited artifact (399.8624ms)\n✔ record-only target does not materialize the preserved M4 fallback (181.3566ms)\n✔ source freshness is separate from intact installed bytes (355.4466ms)\n✔ schema, import, duplicate key, case collision and path escape fail closed (615.2474ms)\n✔ record-only mode rejects prepare-only fields (152.5297ms)\n✔ a symlink or junction escape is rejected when the host permits it (131.0501ms)\n✔ evaluation harness materializes unknown and other-card scenes without overwriting (583.6566ms)\n✔ evaluation harness injects input stale only after an exchange appears and captures the host (642.4635ms)\n✔ response-loss proxy swallows exactly one successful record response (486.1059ms)\n✔ prepare-failure variant is a valid built target with the canonical fallback source (527.9244ms)\n✔ capture sanitizer removes unrelated host hook payloads but keeps evidence events (126.4265ms)\n✔ M4 protocol fixes paired lanes, hosts, scenes, prompt, and canonical control source (7.4559ms)\n✔ inspect returns only graph-derived package, module, target and mechanism relations (461.5608ms)\n✔ inspect rejects fuzzy, case-only, missing and ambiguous forms (540.9849ms)\n✔ standalone prepare returns a locator and an eight-block bounded packet (676.2299ms)\n✔ semantic decision hash is deterministic while exchanges remain nonce-isolated (964.7214ms)\n✔ observer reports unfamiliar prose as unknown instead of inferring meaning (593.0515ms)\n✔ two project copies with identical bytes produce the same semantic hash (791.8029ms)\n✔ preserved prepare-record exchange remains record-compatible (710.6011ms)\n✔ fixture verification command has fixed success and failure evidence (1148.2836ms)\n✔ record preserves human bytes, applies one card, and retries idempotently (1057.9587ms)\n✔ input stale and output conflict are distinct no-write results (1211.8655ms)\n✔ answer unknown fields and pass without evidence fail before output write (687.8425ms)\n✔ record-only initializer and exchange fail closed on non-UTF-8 and unknown state (746.4145ms)\n✔ managed-region bootstrap follows absent, empty, LF, and non-LF byte rules (2151.0846ms)\n✔ renderer preserves another card and updates only the selected card (533.0624ms)\n✔ malformed and duplicate markers are no-write (1009.6326ms)\n✔ duplicate card records are rejected without changing output (569.1432ms)\n✔ renderer failure and non-UTF-8 output are no-write failures (996.6359ms)\n✔ output lock rejects a second record without silent loss (487.2558ms)\n✔ exchange transplant and cross-basis reuse fail closed (684.3048ms)\n✔ post-write reread mismatch never claims observed effect (419.8269ms)\n✔ CRLF-converted managed frame is updated without creating a second region (842.2993ms)\n✔ repository exposes exactly one active generated skill and no active legacy import (62.1588ms)\n✔ authoring generated target is source-current and npm payload excludes implementation roots (1334.6729ms)\nℹ tests 39\nℹ suites 0\nℹ pass 39\nℹ fail 0\nℹ cancelled 0\nℹ skipped 0\nℹ todo 0\nℹ duration_ms 11670.4561:"
      }
    ],
    "treeSha256Before": "7f1a9ff1f54e3a6166788cc778050e663926986df0e5e6d0c7f3a75d6f1f3cc2"
  },
  "hostIdentity": {
    "name": "codex",
    "model": "gpt-5.6-sol",
    "version": "codex-cli 0.148.0",
    "effort": "high",
    "permission": "workspace-write automatic review",
    "freshness": "ephemeral, ignore user config"
  },
  "command": [
    "C:\\Users\\joinj\\AppData\\Local\\Volta\\tools\\image\\node\\24.18.0\\node.exe",
    "C:\\Users\\joinj\\AppData\\Local\\Volta\\tools\\image\\node\\24.18.0\\node_modules\\@openai\\codex\\bin\\codex.js",
    "exec",
    "--skip-git-repo-check",
    "--ephemeral",
    "--ignore-user-config",
    "--approve-for-me",
    "--json",
    "--model",
    "gpt-5.6-sol",
    "--config",
    "model_reasoning_effort=high",
    "-"
  ],
  "hostResult": {
    "exitCode": 0,
    "signal": null,
    "wallClockMs": 433603
  },
  "transcript": {
    "stdoutPath": "evals/m5/results/framework/v2/raw/l0-product-codex-r3-seed1.stdout.jsonl",
    "stdoutBytes": 111189,
    "stdoutSha256": "9494a45a47f4b4d511023b4832962724d5911def5510d875c15bdd5d8f87e6fb",
    "stderrPath": "evals/m5/results/framework/v2/raw/l0-product-codex-r3-seed1.stderr.txt",
    "stderrBytes": 0,
    "stderrSha256": "e3b0c44298fc1c149afbf4c8996fb92427ae41e4649b934ca495991b7852b855"
  },
  "usageRaw": {
    "input_tokens": 853013,
    "cached_input_tokens": 810624,
    "cache_write_input_tokens": 0,
    "output_tokens": 11493,
    "reasoning_output_tokens": 4273
  },
  "cost": {
    "claudeTotalCostUsd": null
  },
  "tokens": {
    "claude": null,
    "codex": {
      "inputTotal": 853013,
      "cachedInput": 810624,
      "output": 11493,
      "reasoning": 4273
    },
    "billedInputTokens": 853013,
    "comparabilityScope": "same-host-only"
  },
  "reads": {
    "promptBytes": 581,
    "entryBytes": 2241,
    "taskBytes": 997,
    "laneMandatedBytes": 0,
    "fixedReadBytes": 3819,
    "toolResultBytes": 75991,
    "frameworkBytesReadApprox": 1003,
    "conditionalReadBytesApprox": 1003,
    "frameworkReadSourceLeak": false,
    "frameworkReads": [
      {
        "source": "package-reference",
        "primitive": "command_execution",
        "rangeKind": "search",
        "returnedBytes": 1003
      }
    ]
  },
  "index": {
    "present": false,
    "bytes": 0,
    "namedInEntry": false,
    "consulted": true,
    "returnedBytes": 1003,
    "boundedReadObserved": "not-applicable"
  },
  "artifactMaintenance": {
    "laneBuildMs": 128,
    "generatedReferenceBytes": 0,
    "generatedIndexBytes": 0,
    "currentnessCheckMs": 116,
    "afterMachineCheckChangeCount": 22,
    "indexMaintenanceCost": null
  },
  "tools": {
    "count": 30,
    "byKind": {
      "read": 8,
      "search": 3,
      "shell": 16,
      "write": 0,
      "edit": 3,
      "other": 0
    },
    "comparabilityScope": "same-host-only"
  },
  "execution": {
    "userRoundtrips": 0,
    "wallClockMs": 433603,
    "preflightRuntimeMs": 12387,
    "machineRuntimeMs": 158,
    "fallbackToolCalls": 1
  },
  "changes": [
    {
      "path": "domains/natural-language-pilot/skill-package.json",
      "before": {
        "bytes": 271,
        "sha256": "c1db77e6c6063dc6e540f13ff60cdfde3cfae63d97891b7f7c0dc1a1a9ef5eee",
        "utf8": "{\n  \"schemaVersion\": 1,\n  \"packageId\": \"natural-language-pilot\",\n  \"packageVersion\": \"0.0.1\",\n  \"modules\": {\n    \"purpose\": \"modules/purpose.md\",\n    \"verifyBaseline\": \"modules/verify-baseline.md\"\n  },\n  \"targets\": {\n    \"verify-next\": \"targets/verify/target.json\"\n  }\n}\n"
      },
      "after": {
        "bytes": 317,
        "sha256": "091b270135dd67ec8e16be48d3b0956eb6e09ca609f72b3cb6ffa6819fcebb0f",
        "utf8": "{\n  \"schemaVersion\": 1,\n  \"packageId\": \"natural-language-pilot\",\n  \"packageVersion\": \"0.0.1\",\n  \"modules\": {\n    \"purpose\": \"modules/purpose.md\",\n    \"verifyBaseline\": \"modules/verify-baseline.md\"\n  },\n  \"targets\": {\n    \"product\": \"targets/product/target.json\",\n    \"verify-next\": \"targets/verify/target.json\"\n  }\n}\n"
      }
    },
    {
      "path": "domains/natural-language-pilot/targets/product/entry.md",
      "before": null,
      "after": {
        "bytes": 1913,
        "sha256": "308412b6f0b8f0f2aebd63056ce133bc6d449c8f410337c6afe786e5bede9826",